sample_158932|උගේ නම අලයා, ඌව ගන්න අපිට මල්වානේ යන්න වුනා, එහේ යන්න හේතුව උනේ මල්වානේ ගෙවල් තියෙන
sample_158933|ඒ දවස් වල ඌ වැඩ කලේ වැල්ලවායේ, ඉතින් උන්ගේ ගෙදරට යද්දී වෙලාව පෙරවරු දොළහයි තිහට වගේ
sample_158934|ලොකු කට්ටක් කාල ඔය ගමනත් ගිහින් එතන තිබුන බඩුමුට්ටු ටිකත් පටවාගෙන අපේ ට්‍රිප් එක නීත්‍යානුකුලවම යන්න
sample_158935|දැන් අපේ අන්තිම සාමාජිකයා ඒ කියන්නෙ කුරූ ඉන්නේ වැල්ලවායේ.
sample_158936|එදා හවස පස්වරු දෙකයි තිහට පටන් ගත්තු ගමන මම එක දිගටම තනියම ඩ්‍රයිව් කලේ
sample_158937|අතින් සල්ලි දාල හරි මුන්ට ලයිෂන් අරන් දෙන්න වටිනවා කියල හිතෙන්නේ මෙන්න මේ වගේ වෙලාවට ඉතින්
sample_158938|අපේ ගමන් මාර්ගය විදිහට අපි තෝරාගෙන තිබුනේ අපි රත්නපුරේ හරහා යන ගමනක් යනවනම් කවදාවත් කොළඹ ඉඳල
sample_158939|රත්නපුරේ පහු වෙලා ටික දුරක් යද්දී කහවත්ත හරියේ දකුණු අත පැත්තේ තියෙනවා හොඳ වතුර උල්පතකින් එන
sample_158940|එහෙත් ඇමතිවරුන් නැති වුණාට දෙමළ ජාතිවාදී පක්ෂ අද ඉතා ම බලවත්.
sample_158941|දෙමළ ජාතිවාදයේ තුන් වැනි යුගයේ දී ඔවුන් පළමු වැනි යුගයටත් වඩා බලසම්පන්න යයි කියන්න පුළුවන්.
sample_158942|මා කලින් කී ආකාරයට සිංහල ඡන්ද බෙදී යෑමෙන් එහි වටිනාකම බිංදුව වී ඇති විට දෙමළ ජාතිවාදී
sample_158943|ඔවුන් අද ඉල්ලීම් ඉටු කරගන්නේ කොටි සංවිධාන බිල්ලා පෙන්වමින් එසේ මධ්‍යයෙහි බලය හැසිරවීමෙනුයි.
sample_158944|නීලන් තිරුචෙල්වම් මහතා මෙන්ම ඩග්ලස් දේවානන්ද මහතා ද අද ආණ්ඩුවේ විශාල බලයක් දරනවා.
sample_158945|එමෙන් ම කදිරගාමර් මහතා ද විදේශ ඇමති ලෙස නොයෙකුත් අවස්ථාවල කොටි සංවිධානය හා දෙමළ ජාතිවාදය වෙනුවෙන්
sample_158946|මේ අතර තොන්ඩමන් මහතා ද ආණ්ඩුවේ ඇමතිවරයකු ලෙස සිටින බව අමතක කරන්න එපා.
sample_158947|යුද්ධයෙන් කොටි සංවිධානය පරාජය කළ යුතු යයි ඔබ කියන විට ඒ දේ සිදුවන්නේ නැද්ද?
sample_158948|එහෙත් ඒ නිසා අවිගත් කොටි සංවිධානය පරාජය කෙරීමට යුද්ධ නොකර ඉන්න බැහැ.
sample_158949|සිංහලයන් හැම විටම ඉතිහාසයේ යුද්ධ කර ඇත්තේ රට රැකීමට මිස ආක‍්‍රමණකාරීව නොවේ.
sample_158950|දෙමළ ජාතිවාදයේ ආයුධ ගත් කොටසින් රට රැකීමට යුද්ධ කර එම කොටස පරාජය කළ යුතුයි.
sample_158951|රිවිරැස ඉදිරිපිම්ම මෙහෙයුම් කුමන අරමුණක් සඳහා කළත් යුද්ධ මෙහෙයුම් මිස ශීල ව්‍යාපාර නොවෙයි.
sample_158952|යුද්ධයට අද කෙලින්ම වියුක්ත ආකාරයකින් විරුද්ධ වන්නේ බංකොලොත් මාක්ස්වාදීන් හා ලිබරල්වාදීන් කිහිප දෙනකු පමණයි.
sample_158953|මොවුන් අද යුද්ධයට විරුද්ධ වීම මගින් ප‍්‍රභාකරන් වෙනුවෙන් වක‍්‍රව හෝ පෙනී සිටිනවා.
sample_158954|මිනිසුන් මිය යන බව කියමින් හිට්ලර්ටට විරුද්ධව යුද්ධ නොකර සිටියා නම් මේ වන විට මුළු ලෝකය
sample_158955|එදා ස්ටැන්ලින් වැනි කොමියුනිස්ට් නායකයොත් හිට්ලර්ට විරුද්ධව යුද්ධ කළා පමණක් නොවෙයි, ඔවුන් එහි දී ඔවුන්ට
sample_158956|මෙරට සමසමාජ නායකයන් එදත් යුද්ධයට විරුද්ධ වුණා නේද? ඔව්.
sample_158957|මිසර ජාතිකයන් පිරමීඩ තනන්නට බොහෝ කලකට පෙර ක්‍රිස්තු පූර්ව පන්දහසකදී පමණ යුරෝපයේ ජීවත් වූ මිනිසුන්
sample_158958|ඔවුන් කී දේ අසා යුද්ධ නොකළා නම් හිට්ලර් මුළු ලෝකයම අත්පත් කරගන්නවා.
sample_158959|ඒ ගොවීන් සරු බිම්වල වගා කළ අය වූ අතර ගොවිතැන සඳහා ඒ කාලයේ හැටියට නවීන පන්නයේ
sample_158960|ඒ අතර අනෙක් ගොවියන් කුස ගින්නේ සිට ඇති බවද මේ සොහොන් පරීක්ෂා කිරීමේ දී හෙළිදරවු වුණා.
sample_158961|ප‍්‍රභාකරන් බලයට පත් වුවහොත් අද යුද්ධය එපා ය කියන බංකොලොත් මාක්ස්වාදීන්වත් ඔවුන් හිටපු මාක්ස්වාදීන් දැයි පැහැදිලි
sample_158962|එදාටත් ඔවුන් යුද්ධයට විපක්ෂ වේවි ද? මොවුන් යුද්ධයට විරුද්ධ වන්නේ ඉතා ම වියුක්තවය.
sample_158963|ඔවුන් ගේ ජීවිතවලට රට ජාතිය එතරම් වැදගත් නොවන බැවින්.
sample_158964|එහෙත් ඔවුන් ගේ ජීවිතවලට හානි පැමිණෙන බවක් දැනුනහොත් ඔවුන් යුද්ධයට පක්ෂ වෙනවා.
sample_158965|අපට මතකයි මේ බංකොලොත් මාක්ස්වාදීන් ජනතා විමුක්ති පෙරමුණේ තර්ජනය හමුවේ ආණ්ඩුවේ,
sample_158966|ආණ්ඩුවේ, පිළිසරණ පතමින් ආණ්ඩුව හා එකට එක් වී ආයුධ ලබාගනිමින් සටන් කළ හැටි.
sample_158967|මේ ලිපිය තමන්ට අවශ්‍ය පරිදි මගේ තෝරාගත් ලිපි පමණක් පළකරන පුවත්පත්, වෙබ් අඩවි ආදිය සඳහා ඉදිරිපත්
sample_158968|එහෙත් කිසිවකුට තම මිතුරන්ට එය ඉදිරිපත් කිරීමේ බාධාවක් නැත.
sample_158969|මේ ලිපිය ද තවත් ලිපි ද මුහුණු පොතෙන් ද කාලය වෙබ් අඩවියෙන් ද කියවිය හැකි
sample_158970|නාගසාකි නගරයට පරමාණු බෝම්බ හෙලීමේ හැත්තෑ තුන්වන සංවත්සරය ජපානය අද දින සමරයි
sample_158971|අද දින උදෑසන මෙම උත්සවය සාම උද්‍යානයේදී උත්සවශ්‍රීයෙන් සැලසුම් කර තිබේ.
sample_158972|මෙම අවස්ථාවට ඇන්ටෝනියෝ ගෝටෙරස් සහභාගී වන අතර ඔහු ප්‍රථම එක්සත් ජාතීන්ගේ ප්‍රධානියා බවට පත්වනු ඇත.
sample_158973|ඔහු සමග මෙම අවස්ථාවට ප්‍රහාරයට ගොදුරු වූ අයගේ පවුලේ අය සහ අගමැති ෂින්සෝ අබේ සහභාගී
sample_158974|අභ්‍යවකාශ ඉංජිනේරු චිචී අනධ්‍යයන සේවකයෙක්ලු? ඉන්ෆෝ ශ්‍රී ලංකා නිවුස් සිංහල අභ්‍යවකාශ ඉංජිනේරු චිචී අනධ්‍යයන
sample_158975|අභ්‍යවකාශ ඉංජිනේරුවකු ලෙස තමන්ව හඳුන්වා ගත් රෝහිත රාජපක්ෂ විශ්වවිද්‍යාලයක අනධ්‍යයන සේවකයකු ලෙස කටුතු කිරීම ගැටළු සහගත
sample_158976|කොළඹ විශ්වවිද්‍යාලයේ විශ්වාස කටයුතු ආරංචි මාර්ග පවසන්නේ ඔහුගේ නම සඳහන්ව තිබුණද කිසිදු ආකාරයකින් ඔහු විහ්වවිද්‍යාලයේ කටයුතු
sample_158977|සුප්‍ර්‍රීම් සැට් චන්ද්‍රිකාව අභ්‍යවකාශයට යැවීම පිළිබඳව මාධ්‍ය මගින් මෙන්ම වෙනත් ප්‍රචාරක ව්‍යාපෘති හරහා ද පුළුල් ප්‍රචාරයක්
sample_158978|ලංකාවේ ප්‍රථම චන්ද්‍රිකාව ලෙස හැඳින්වුණු මේ ව්‍යාපෘතියේ හිටපු ඇමැති රවී කරුණානායකගේ ව්‍යාපාර සගයකු වන මනිවානන් නමැත්තා
sample_158979|ඔහු මෙ වනවිටත් ලිතුවේනියාවේ රාජ්‍ය තාන්ත්‍රිකයකු ලෙස වර්තමාන ආණ්ඩුව මගින් ද පත් කර ඇත්තෙකි.
sample_158980|රෝහිත රාජපක්ෂ අදාළ ව්‍යාපෘතිය හරහා වැය කළ මුදල සම්බන්ධයෙන් චෝදනා එල්ල වී තිබියදී
sample_158981|ඉන්ෆෝ ශ්‍රී ලංකා නිවුස් සිංහල මුල් පිටුව විශේෂාංග පුවත්
sample_158982|යහපාලන ආණ්ඩුවේ නියෝජ්‍ය ඇමතිවරයෙකු වන සුජීව සේනසිංහ සම්බන්ධයෙන් නොයෙක් පුවත් පසුගිය කාලයේ වාර්තා වූ අතර මේ
sample_158983|මින් වාර්තාවක් වන්නේ ලංකාවේ තරු පහේ හෝටල් කිහිපයකට කොකේන් බෙදා හරිනු ලබන බානුක නැමැත්තා සමග මොහුගේ
sample_158984|මේ සම්බන්ධය ගැටළුවක් බවට පත්වූයේ බානුක නැමැත්තා පොලීසිය විසින් හා මත්ද්‍රව්‍ය නිවාරණ අංශය විසින් අත්අඩංගුවට ගැනීම
sample_158985|මත් ද්‍රව්‍ය නිවාරණ අංශයේ නිලධාරීන් පසුගියදා මෙම තැනැත්තා රැදී සිටි සෙවන් ඩිග්‍රීස් නැමැති සමාජ ශාලාව වෙත
sample_158986|සුජීව සේනසිංහ නියෝජ්‍ය ඇමැතිවරයාගේ තවත් බලහත්කාරී හා මංකොල්ලකෑමක ස්වරූපයේ පුවතක් වාර්තා වන්නේ දෙහිවල ප්‍රදේශයෙනි.
sample_158987|දෙහිවල අමරසිංහ නැමැති තැනැත්තියට අයත් දේපලක් තර්ජනාත්මකව ඉතා අඩු මුදලකට මිලදී ගැනීමකි.
sample_158988|ඇය සතු මෙම ඉඩමේ වටිනාකම මිලියන හැත්තෑපහක් වන නමුත් අදාළ ඉඩමේ වටිනාකම ලක්ෂ හැත්තෑපහක් බව දක්වා
sample_158989|ඉන් නොනැවතුනු නියෝජ්‍ය ඇමැතිවරයා අදාල ඉඩමට ආසන්නයේ පවතින සංචාරක හෝටලයක වැට මායිමද ඉක්මවා තම මායිම් සලකුණු
sample_158990|මෙම ඇමතිවරයාගේ කටයුතු සම්බන්ධයෙන් මේ වනවිට එක්සත් ජාතික පක්ෂ නායකයාටද පැමිණිලි
sample_158991|කොහොමද විද්යුත් තැපැල් වැඩ පෙරහන් දස ප්‍රහාරය මගින් වසාගනු අපේ විද්යුත් තැපැල් ගිණුම් විවෘත
sample_158992|ක්රිස් බ්රයන්ට් ඔබේ සී සී එන් ඒ හා සැබෑ ලෝකය සාර්ථකත්වය සඳහා
sample_158993|පරිගණක හා අන්තර්ජාල ටීකාව ගැන ඇති විය යුතු දැනුම ඒ පරිගණක හා අන්තර්ජාල පාරිභාෂික ශබ්ද මාලාව ඔබ
sample_158994|පරිගණක ආශ්රිත දේවල් සියල්ල තමන්ගේ භාෂාව සතුව ස්ථාවර නම් හා ඔබ විසින් එය සියලු දැන ගැනීමට
sample_158995|බව ප්රසිද්ධ කරුණකි වින්ඩෝස් මෙහෙයුම් පද්ධතිය කාලයක් සමග අස්ථාවර බවට පත් වෙයි.
sample_158996|එය නිතිපතා ඝෝෂාකාරී, ලේඛාධිකාරයෙහි වැඩකට නැති කාර්යයන් හා කුණු කූඩයට ගොඩක් අත්පත් කර ගනී.
sample_158997|විශේෂඥයන් මුල සිට වින්ඩෝස් නැවත ස්ථාපනය නිර්දේශ වසරකට වඩා අඩු නොවන.
sample_158998|බොහෝ පරිශීලකයින් දීර්ඝ ලෙස වින්ඩෝස් නැවත ස්ථාපනය හිතන්න සාමාන්ය ක්‍රියාවලිය සාමාන්යයෙන් දෘඩ තැටිය හැඩතල සමග.
sample_158999|සාමාන්යයෙන් ඒක තමයි විදිහ ඔබ අතින් හා පැරණි තාලයේ ආකාරයෙන් එය කරන්න නම්.
sample_159000|එය දැනටමත් විසිඑක්වන සියවසේ වන අතර එය අත්පොත හා දත්ත නැතිවීම් ගැන අමතක
sample_159001|රැහැන් රහිත පී ඕ එස් සහ රැහැන් රහිත ජංගම පරිගණක ලාභය වැඩි වන බව ආපන ශාලා මෘදුකාංග හොඳම
sample_159002|හැත්තෑ හතර මම මගේ අනුවාදය යාවත්කාලීන විට දෝෂය ඇති ශුන්ය.
sample_159003|හැත්තෑ තුන ස්වයංක්රීයව මෘදු හරහා ඇය ඉංග්රීසි භාෂාවට පෘතුගීසි බව මගේ වෙබ් අඩවිය බවට පත් විය.
sample_159004|මම කොහොමද පෘතුගීසි ආපසු නෑ මෙම වෙබ් අඩවිය භාෂා  දැන් ඔබ විසින්
sample_159005|තවමත් පහසු පෙර පරිවර්තනය අතුරු මුහුණත බලා.
sample_159006|පලවෙනි හේතුව මේ තරම් වැඩ කටයුතු  මෙය බොහෝ විට අසන්නට හරි තැන නොව
sample_159007|කලහැක්කේ පරිපාලකවරුන්ට හා සංස්කාරකයන් පරිවර්තනය කිරීමට තබා අය පමණක් නම්, ඔවුන් හැම දෙයක්ම දකින්න පුළුවන්,
sample_159008|හොඳම අදහසක් අපට සෝරෝ අඩවියේ මෙය කිරීමට ඔබ ටිකට් පතක් නිර්මාණය කරන බවය
sample_159009|ලොකු ලූනු ගොවීන්ගෙන් බලධාරීන්ට චෝදනා ශ්‍රී ලංකා නිවුස් ෆස්ට් ලොකු ලූනු බීජ
sample_159010|කැබිනට් අනුමැතිය මත කෘෂිකර්ම දෙපාර්තමේන්තුව මගින් දේශීය ලොකු ලූනූ ගොවීන්ට ලොකු ලූනූ බීජ ලබා දීමේ වැඩසටහනක් ක්‍රියාත්මක
sample_159011|ඒ, රුපියල් නවදහසක් වන ලොකු ලූනූ බීජ කිලෝ එකක් රුපියල් හාරදහස් පන්සියයක් වැනි මුදලකට දේශීය ලොකු ලූනූ
sample_159012|කෘෂිකර්ම දෙපාර්තමේන්තුව දැනුවත් කර ඇති පරිදි මෙම ලොකු ලූනු බීජ මිලදී ගත යුත්තේ ද බීජ නිෂ්පාදනය
sample_159013|ඒ සඳහා ඔවුන්ට රුපියල් හාරදහස් පන්සියය්ක මුදලක් ගෙවීම ප්‍රමාණවත් වන අතර ඉදිරි මුදල්
sample_159014|නමුත් බීජ නිෂ්පාදනය කරන ගොවීන් චෝදනා කරන්නේ මෙම චෙක් පත් ගෙවීම නිසි ලෙස සිදු නොවන බවයි.
sample_159015|මේ හේතුවෙන් ලොකු ලූනු නිෂ්පාදනය කරන ගොවීන් දැඩි අපහසුතාවට පත්ව ඇති බව ද ඔවුන් පෙන්වා දෙයි.
sample_159016|පසුව මේ පිළිබඳව පළාත් කෘෂිකර්ම අධ්‍යක්ෂවරයාට දන්වා ඇති අතර ඔහු දැනුම් දී ඇත්තේ
sample_159017|උසස් තත්වයේ කිතුල් හකුරු ග්‍රෑම් පන්සියයයි බිත්තර දහයයි කුඩුකර ගත් සාදික්කා කුඩු තේ හැඳි
sample_159018|පොල් කිරි හා මිශ්‍ර කර බීටරයකින් කලවම් කර ගන්න.
sample_159019|බිත්තර ගසා එයටම හකුරු මිශ්‍රණය දමා හොඳින් බීට් කර ගන්න.
sample_159020|විනාඩි හතලිස් පහත් පැයක් පමණ වෙලා පිලිස්සීමට ගතවන කාලයයි.
sample_159021|එවිට එය වඩා මෘදු ගතියකින් හා පැණි ගතියකින් යුක්ත නිසා.
sample_159022|වතුර භාජණයක් මත තබා කට හොඳින් වතුර නොයන ලෙස බැඳ ලිපේ තබා තම්බා ගන්න.
sample_159023|මිශ්‍රණය එහි නො ඇලේ නම් එය තැම්බී ඇති බව පෙනේ.
sample_159024|මයිකොවේව් උඳුනේ එහි ඇති උපදෙස් අනුව වාෂ්පයෙන් තම්බා ගත හැක.
sample_159025|පාන් පිටි ග්‍රෑම් හත්සිය පනහ මාගරින් හෝ බටර් ග්‍රෑම් සියය දිය ලුණු කුඩු තේ හැඳි එකක්
sample_159026|මද රස්නෙ වතුර කෝප්ප භාගයයි ගසා ගත් බිත්තර දෙකයි පාන්වල තවරා ගැනීම සඳහා බිත්තර
sample_159027|මෙම බෝලය ටික ටික ගෙන තෙල් තවරන ලද මේසයක දමා හොඳින් අත් ගසා ගන්න.
sample_159028|මෙහිදී අත්ල මේසය මතට තද කරමින් පිටි මෝලිය දිග් අතට අත් ගැසීම හරිම වැදගත්.
sample_159029|විනාඩි පහළවක් මේ ලෙස අත් ගැසූ පිටි මෝලිය හොඳින් රවුම් කර තෙල් ස්වල්පයක් තවරා බේසමට දමන්න.
sample_159030|තෙමනලද තුවායකින් වසා පැ එක හමාරක් දෙකක් පිපෙන්නට තබන්න.
sample_159031|හොඳින් පිපුන පසු මෙම පිටි මෝලිය දෙගුණයක් තරම් වනු ඇත.
sample_159032|මෙය අතින් තද කර ආයෙමත් පෙර ප්‍රමාණයට ගෙන තවත් විනාඩි දහයක් පමණ තබා කුඩා ප්‍රමාණයේ රවුම්
sample_159033|මේසයක හෝ ලෑල්ලක තුනී කර ඒ මැදට මාළු මිශ්‍රණය දමා ලියුම් කවරයක් ආකාරයට තුන්මුලස් ආකාරයට නවා
sample_159034|මෙම මාළු බනිස් තවත් පැය භාගයක් පිපෙන්නට තබන්න.
sample_159035|ඊට පසු බිත්තර කහමද හා සීනි උඩින් තවරා සෙල්සියස් අංශක දෙසීයක පමණ
sample_159036|මාළු හෝ සාඩින් ග්‍රෑම් දෙසිය පනහක් අල ග්‍රෑම් පන්සියයක් ලොකු ලූණු ග්‍රෑම් දෙසිය පනහක්
sample_159037|ලූනු සහ අමු මිරිස්, සුදු ලූනු, ඉඟුරු ,කරපිංචා , කොත්තමල්ලි කොල හීනියට ලියා ගන්න.
sample_159038|තෙල් රත්කර එයට සුදු ලූනු ඉඟුරු හා ලියා ගත් ලූනු දමා බැද ගන්න.
sample_159039|එය රන්වන් පාට වූ පසුව මාළු සහ අල හා අනෙකුත් ද්‍රව්‍ය දමා කලවම් කර තම්බා නිවෙන්නට
sample_159040|එම විශේෂඥ වෛද්‍යවරයා රෝහල් අධ්‍යක්ෂවරයා වෙත පවසා ඇත්තේ එම රෝදයේ සුළං බැස ඇති නිසා
sample_159041|කරාපිටිය ශික්ෂණ රෝහලේ රථ ගාලේ වාහන නවතා තැබීම සම්බන්ධයෙන්
sample_159042|විශේෂඥ වෛද්‍යවරුන් සිය මෝටර් රථ නවතා තබන ස්ථානයේ සාමාන්‍ය වෛද්‍යවරුන්ගේ ද මෝටර් රථ නවතා තැබීම
