sample_158471|පෙන්වා දෙන ආකාරයට ලෝකයේ සෑම හතෙන් එක් අයෙකු නින්ද යන්නේ කෑමට යමක් නැතිව කුසගින්නෙනි.
sample_158472|විශේෂයෙන් ම සංවර්ධනය වන ලෝකයේ රටවල සෑම ළමුන් හතර දෙනෙකුන් එක් අයෙක්
sample_158473|තුන්වන ලෝකයේ ජන ගහණයෙන් දහසයක් කුසගින්නෙන් පෙළෙන ජන කොටසක් වේ.
sample_158474|දෙදහස් එකොලහෙදී ලෝකයෙන් බිලියන එකකට සාක්ෂරතාවයක් නැත.
sample_158475|හයකට බීමට පිරිසිදු පානීය ජලය නැත.
sample_158476|ලෝක ජන සංඛ්‍යාවෙන් අඩක ආයු අපේක්ෂාව වසර හැත්තෑවක් වන අතර අනෙක් අඩෙහි ආයු අපේක්ෂාව
sample_158477|වඩාත්ම දුක්ඛිත තත්වය වන්නේ ලෝක ආදායමෙන් සියයට හැත්තෑ පහක් පමණ බෙදා ගන්නේ ලෝක ජන සංඛ්‍යාවෙන්
sample_158478|ලෝකයේ ඉතාම දුප්පත් සියයට හතලිහක් අතර බෙදි යන්නේ ලෝකයේ සමස්ත ආදායමෙන් සියයට පහකි.
sample_158479|ලෝක ආහාර ගැටළුවට බලපාන හේතු දෙස භූගෝල විද්‍යාත්මක බලන විට
sample_158480|ඉඩම් කැබලි වීම, ඉඩම් හිඟය, ඉඩම් අධි භාවිතය හා මුඩු බිම්.
sample_158481|මේ සියළු තත්ත්වයන් එකතුව නිර්මාණය කරනු ලබන ආහාර ගැටළුවේ පැති තුනක් තිබේ.
sample_158482|ඒ අය වෙනුවෙන් අපිට කරන්න තියෙන්නේ මොනවාද? ඉහත දක්වා ඇති දත්ත ලෝක බැංකුවේ දත්ත සටහන් අශ්‍රීතව
sample_158483|මෙම රූපයෙන් පැහැදිලි වන ආකාරයේ සැබෑ නැමීමක් මතුපිට සිට බලන කෙනෙකුට දැක ගන්නේ කලාතුරකිනි.
sample_158484|එවැනි එක් අවස්ථාවක් මෙහි ප්‍රථමයෙන් දක්වා ඇති රූපයෙන් දැක්වේ.
sample_158485|බොහෝ විට අප ඇවිද යන භූමිය අභ්‍යන්තර නැමි තිබිය හැක.
sample_158486|ඒවා දැක ගත හැකි වන්නේ ඒ පස් ස්ථරය හා කැපුමක් යෙදු විටක වැනි අවස්ථාවක ය.
sample_158487|මේ අතුරෙන් කිහිපයක් පමණක් මෙහි ලා සළකා බලා ඇත.
sample_158488|විවිධ විභාග සඳහා භූ රූප ඇඳ දක්වන විට කාලය ඉතිරි කරගෙන රෑපය ඉතා හොඳින් පැහැදිලි වන
sample_158489|නැමි කඳු භූ රූපණය අනුව වර්ග කිරීම අවසාදිත ස්ථර ඇසුරින් පැහැදිලි කර ඇත.
sample_158490|ද්වීමාන රූප සටහන් මා විසින් ඇඳ ඇති අතර ත්‍රිමාණ ඒවා අන්තර්ජාලයෙනි.
sample_158491|සාමාන්‍ය නැමි, නිර්මාණය වීමෙදී වෙනස් ප්‍රතිරෝධකතා සහිත පාෂාණ ස්ථර නැවීමෙන් මේවා සෑදේ.
sample_158492|දෙපසින් ලැබෙන පීඩනයේ අසමානතාවය හා පාෂාණ ස්ථරයන්ගේ අසමාන බව නිසා එක් පැත්තක පීඩනයට වඩා අනෙක් පැත්තේ
sample_158493|එවිට සෑදෙන භූ රූපයේ බාහු වල අසමාන බවක් දැකිය හැකි වීම විශේෂයයි.
sample_158494|එනම් නැම්මේ එක් අංශකයක් අනෙකට වඩා බෑවුම් සහිත ය.
sample_158495|මෙම භූ රූපය නිර්මාණය වන පාෂාණ ස්ථරයන් සමාන වේ.
sample_158496|එක්තරා ආකාරයට විභේදයක් සේ සැලකිය හැකි මෙය නිර්මාණය වන්නේ නැමි අක්ෂය අසලින් පාෂාණ බිඳිමෙනි.
sample_158497|නමුත් නැපියක් සේ විශාල බලයක් මෙයට හේතු නොවන නිසා මෙහි මතුපිට පාෂාණ ස්ථරය එතරම් දුරකට යන්නේ
sample_158498|මෙහි පහළ තිබෙන ස්ථර තියුණු අවපාතයක් හෝ පොළවට සමාන්තරව විහිදෙන, මෘදු බෑවුමක් සහිත ආකාරයට සමන්විත වේ.
sample_158499|අභ්‍යන්තරික පාෂාණ තට්ටු වෙනස් බල මඟින් සම්පීඩනය වීම හේතුවෙන් නිර්මාණය වේ.
sample_158500|ඕස්ට්‍රේලියාව ඔත් නැම්මක හෝ ඒකානති නැම්මක උඩ පිහිටි බාහුව මතට වැඩි පීඩනයක් ඇති
sample_158501|මෙසේ තල්ලු වන කොටස සිදුවු ස්ථානයෙන් කිලෝමීටර ගණනාවක් ඈත තැම්පත් වී තිබිය හැක.
sample_158502|අයෙකුට මෙය සම්පීඩනය නිසා ඇතිවන විභේද අවස්ථාවක් සේ වුවත් සැලකිය හැකි නමුදු මෙය නිර්මාණය වන්නේ
sample_158503|කෙසේ වුවත් මෙවැනි සංකීර්ණ නැමි ලෝකයේ ඉතාම විරල වේ.
sample_158504|උපරිපතනය, අතිව්‍යාප්ත ව්‍යුහය යනුවෙන්ද මෙම භූ රූපය හැදින්වේ.
sample_158505|නමුත් මේවා කුඩා පරිමාණයෙන් කඳුවල දැකිය හැකි යැයි ඇතැම්හු අදහස් කරති.
sample_158506|ස්කොට්ලන්තයේ වයඹ දිග කඳු අතර මෙම ලක්ෂණ දැකිය හැක.
sample_158507|එමෙන් ම යුරෝපයේ මධ්‍යම ඇල්ප්ස් වලද, නැගෙනහිර රොකී කඳු වල දැකිය හැක
sample_158508|විශාල සහනති මඩුල්ලක සුළු ප්‍රතිනති හා සහනති සංඛ්‍යාවක්,
sample_158509|ශ්‍රී ලංකාවේ ව්‍යුහයේ බටහිර නැගෙනහිර හරස්කඩ පරික්ෂා කිරීමෙන් මධ්‍යම කඳුකරය මෙවැනි භූ රූපයකට නිදසුන් සපයන
sample_158510|ඒ ගැන සවිස්තරාත්මකව ලංකාවේ භූ විද්‍යාත්මක සැකැස්ම පිළිබඳ කරනු ලබන ලිපි පෙළින් පැහැදිලි කර ගමු.
sample_158511|ඒ අනුව යටි නැම්මේ දුම්බර මිටියාවත හා වත්තේගම සිට කටුගස්තොට ද උඩු නැමි වල හන්තාන දොළොස්බාගේ
sample_158512|මේ බව පැහැදිලි කරන රූපසටහනක් භෞතික භූගෝල විද්‍යාව
sample_158513|අධ්‍යාපන ප්‍රකාශන දෙපාර්තමේන්තු ග්‍රන්ථයේ විසි අට වන පිටුවේ තිබේ.
sample_158514|එමෙන්ම විශාල ප්‍රතිනතියක් හෙවත් යටි නැම්මක් තුළ සුළු ප්‍රතිනති හා සහනති හෙවත් උඩු හා යටි නැමි
sample_158515|එංගලන්තයේ විල්ඩ් ප්‍රදේශයේ මීට නිදසුන් තිබේ තරමක් විශාල යටි නැම්මක්.
sample_158516|නමුත් ලෝකයේ මීට වඩා අති දැවැන්ත යටි නැමි තිබේ.
sample_158517|ඇත්තෙන්ම මේ නැම්මට සිංහලෙන් කියන නම මා දන්නේ නැත.
sample_158518|මේවා නිලධාරින්ගේ නිලපටි ආකාරයට සමාන නිසා මේ නම් භාවිතා වන බවක් තමා විකිපීඩියාව නම් දක්වන්නේ.
sample_158519|මේවා තද නැමි වන අතර අංශක හත්තෑවක් අසූවක් පමණ ආනත වී තිබෙනවා.
sample_158520|ඍජු බාහු මෙන් ම මේවායේ උල් වු කොන් සහිත නැමි දැකිය හැකියි.
sample_158521|උසස් පෙළ භෞතික මානව හා ආර්ථික භූගෝල විද්‍යාව
sample_158522|රාජ්‍ය භාෂා පරිවර්තන දෙපාර්තමේන්තුවේ ප්‍රකාශන අංශය
sample_158523|ද්විමාන හා ත්‍රිමාණ රූපසටහන් ආකාර දෙකින් ම ඉදිරිපත් කර ඇත්තේ ඉතා පහසුවෙන් තේරැම් ගැනිමට ය.
sample_158524|සමහර රූපසටන් අන්තර්ජාලයෙන් ලබා ගැනීමේදී හමුවන්නේ රූපය පමණි.
sample_158525|නමුත් උත්සාහ කරන්නේ නම් ඒවා සොයා ගැනීමට නොහැකි නොවේ යැයි සිතමි.
sample_158526|භෞතික භූගෝල විද්‍යාව සෑම මහද්විපයකටම ඊට ආවේනික වු රටාවකට හැඩ ගැසුණු විවිධත්වයකින් යුතු භූ රූපනයක්
sample_158527|කඳු නිර්මාණය වන්නේ පෘථිවියේ අභ්‍යන්තරයේ සිදුවන විවිධ ක්‍රියාවලි නිසා බව විද්වතුන්ගේ මතයයි
sample_158528|ඒ කඳු අතර දැවැන්ත නැමි කඳු සුවිශේෂි තැනක් ගනී.
sample_158529|වසර දහස් ගණනක් තිස්සේ පාෂාණ තැටි තල්ලු වී යාම හා තෙරපීම හේතුවෙන් පාෂාණ නැමීම ‍නිසා
sample_158530|ලෝ ප්‍රකට දැවැන්ත කඳු වන අන්දීස්, රොකී, හිමාලයා, ඇට්ලස්, ඇල්ප්ස්, ආදී නැමි කඳුවලට උදාහරණ වේ.
sample_158531|මේවා සාගරයට ඉතා ආසන්නයේ තැටි මායිම් අසළ පිහිටා ඇත.
sample_158532|එමෙන්ම මේ කඳු මුදුන්වල තිබී සාගරික මසුන්ගේ පොසිල හමු වී ඇත.
sample_158533|යුරල් ඇපලාචියන් වැනි අභ්‍යන්තරික ව විහිදි ඇති නැමි කඳු ද තිබේ.
sample_158534|නමුත් වැඩි වශයෙන්ම පරික්ෂණ පවත්වා ඇත්තේ ඇල්පයින් කඳු පද්ධතිය පිළිබඳව වේ.
sample_158535|ඇල්පයින් කඳු වලට යුරෝපයේ ඇල්ප්ස් සහ ආසියාවේ හිමාලයා කඳු අයත් වේ.
sample_158536|මෙම කඳු පෘථිවි භූ ඉතිහාසයේ තෘතික භු යුගයේ දී ඇති වී ඇතැයි සැළකේ.
sample_158537|රූපයෙන් පෙනෙන පරිදි හෝ ස්ථිර හා බලවත් පාශාණයක් හමුවේදී දුර්වල පාශාණ ස්ථරය නොවේ.
sample_158538|කෙසේ වුවද මේ නැමි කඳු දිගු පේළි වශයෙන් හෝ චාප වශයෙන් ඇති බව පෙනේ.
sample_158539|නැමි කඳු සෑදෙන්නේ පීඩන ඇති වු දිශාවට සෘජු කෝණික ලෙස ය.
sample_158540|ලෝකයේ විශාල කඳු හා සානු ,තැනිතලා ,ආගාධ ඇති කරනු ලබන්නේ පෘථිවි පාෂාණ අතර සිදු වන චලන
sample_158541|එම චලනයන් එසේ ඇති කරන්නේ පෘථිවි අභ්‍යන්තරයේ පවතින සංවහන ධාරා හා විකිරණශීලී ඛනිජ වල ශක්තිය
sample_158542|එසේ ම මේ හැම ක්‍රියාවකටම ශක්තිය ලබා දෙන්නේ සුර්යයා විසින් ය.
sample_158543|සුර්යය තාපය හේතුවෙන් හට ගන්න භූ තාපය බොහෝ අන්තර්ජන්‍ය ක්‍රියාවලීන්ට අවශ්‍ය ශක්තිය නිපදවනු ලැබේ.
sample_158544|මේ ලිපිය අවසානයේ දී මතක තබා ගත යුතුම කරුණක් වන්නේ එක කන්දක් හැදෙන්න බලපාලා තියෙන්නේ
sample_158545|එක කන්දක මෙවැනි විවිධ නැමි වර්ග බොහෝමයක් තිබිය හැකියි.
sample_158546|පෘථිවියේ හට ගන්නා සියලුම භූ ලක්ෂණ ක්‍රියාවලීන් දෙකකට අයත් වේ.
sample_158547|ඒවා නම්, බහිර්ජන්‍ය ක්‍රියාවලි අර්ථයෙන් හැඟවෙන පරිදි පිටතින් සිදු වේ.
sample_158548|ගලන ජලය, සුළඟ, අයිස්, සාගර තරංග, ග්ලැසියර යන ඒවා නග්නීකරණකාරක නැතහොත් බහිර්ජන්‍යකාරක ලෙස හඳුනා ගත හැක.
sample_158549|මේවා විසින් පෘථිවි පෘෂ්ඨය ගෙවීමකට ලක් කිරීම එනම් විෂමතාව නැති කිරීම සිදු කරයි.
sample_158550|භූ කම්පන වල ප්‍රතිඵල වශයෙන් ඉරිතැලීම් හා ‍දැදුරු ඇති වීමෙන් ද ,යමකම ක්‍රියාවලියේ දී ඒවා විදාරණය
sample_158551|අභ්‍යන්තරයේ ඇති වන බලවේග ක්‍රියාත්මක වන්නේ සිරස් අතර නම් ඒවා සිරස් බලවේග වේ.
sample_158552|මේ මඟින් මහද්වීප හා සාගර වල චලනයන් සිදු කරනු ලැබේ.
sample_158553|මෙසේ ඛාදනයට ලක් වන පාෂාණ ඛාදනය වී තැම්පත් වන්නේ පහල තැන්වලය.
sample_158554|මෙසේ තැම්පත් විමෙන් පෘථීවියේ යම් තැනක එනම් ඛාදනයට ලක්වන තැන පිහිටි භූ ස්කන්ධයේ බර අඩු වීමත්
sample_158555|කලක් තිස්සේ මෙසේ බර දරා සිටින භූ ස්කන්ධ වල බර සැහැල්ලු වීම නිසා
sample_158556|මේවා එක්තරා ආකාරයක සිරස් චලනය වීමක් ලෙස ඇතැමුන් විග්‍රහ කරන්නෙ එබැවිනි.
sample_158557|ඉතා වැදගත් ම කරුණ වන්නේ භූ ස්කන්ධයක් මේ ආදී ක්‍රියා නිසා ඉහළ පහළයාමක් පමණක් නොව
sample_158558|ග්ලැසියර් වැනි දේ වසර දහස් ගණන් පෘශ්ඨය මත තැම්පත් වීම නිසා කලකදී ඒවා ඒ බරින් පහත්
sample_158559|පසුව මෙම ග්ලැසියර ක්‍රම ක්‍රමයෙන් දියවී යාම හේතු කර ගෙන අර භූමිවල තිබු බර සැහැල්ලු වී
sample_158560|පසුව ග්ලැසියරය දියවි ගිය පසු අද පවා මේ භූමි ස්කන්ධය නැවත එසවෙමින් තිබේ.
sample_158561|මේ ආකාරයට මහද්වීපික කොටස් ඉහළ පහළ යාම කෙරෙහි මෙම චලන බලපා ඇත.
sample_158562|නැත්නම් එසේ ඉහළ පහළ යන චලන වලට මේ නම භාවිතා කරති.
sample_158563|සිරස් භූ චලන නිසා නිර්මාණය වන්නේ විශාල පරිමාණයේ භූ රූප වන සානු , ද්‍රෝණි
sample_158564|අභ්‍යන්තරයේ ඇතිවන බලවේග ක්‍රියාත්මක වන්නේ තිරස් අතට නම් එය තිරස් බලවේගයක් වේ.
sample_158565|පෘථිවියේ දුර්වල පාෂාණ කොටස් තිරස් බලවේග නිසා පවතින හැඩයෙන් වෙනස් වේ.
sample_158566|එක තැනක සම්පීඩනයක් ඇති වන විට ඒත් සමඟ ම තවත් තැනක
sample_158567|මෙවැනි විශාල කඳු පද්ධති ඇති කරන්නට මේවා බලපානවා සේ ම කුඩා ප්‍රමාණය සම්පීඩනය වීම් නිසා ද
sample_158568|භෞතික භුගෝල විද්‍යාව හා දේශගුණ විද්‍යාව
sample_158569|අධ්‍යාපන ප්‍රකාශන දෙපාර්තමේන්තුව මේ පොත් බොහෝ දුරට පුස්තකාල වල තියෙන ඒවා.
sample_158570|නමුත් පරිශිලනය ඉතාම අඩු හංදා ඒවායේ දැනුම සමාජ ගත වෙන්නේ නෑ.
sample_158571|හැමවිටම න්‍යායෙන් සංකල්පයෙන් මෙන් ම අත්දැකීම් හා අත්විදිම් වලින් පෝෂණය වන තරමට තමා වටිනාකම වැඩි වෙන්නේ.
sample_158572|අනික පුංචි පුංචි රෑපවලින් මේ දැවැන්ත ක්‍රියාවලින් පැහැදිලි වෙන රෑප දාන්නත් බෑ.
sample_158573|ඉතිං ලොකු පිංතුර එක්ක තමා මේ වැඩේ කරන්න වෙන්නේ.
sample_158574|මේ තමා ආශ්චර්යමත් පෘථිවියේ පය ගහලා ඉන්න ගෙන්දගම් පොළොවේ මැවුනු හැටි.
sample_158575|මේවා අධ්‍යයනය කරපු භූගර්භ විද්‍යාඥයින්, භූගෝල විද්‍යාඥයින් ඒවා අඳුන ගන්න විවිධ පදනම් අනුව වර්ග කළා.
sample_158576|අපට පාෂාණ ස්ථරවල නැමි නිරික්ෂණය කරන්නට අවශ්‍ය නම් මහා කඳු සොයමින් යා යුතු නැහැ.
sample_158577|ඉතා කුඩා ප්‍රමාණයේ නැමි ඔබගේ ගෙවත්තේ ඇති කුමක් හෝ ඉදි කිරීමකට ගෙන ආ කළු ගල් කැබලිවල
sample_158578|මේ අනුව පහසුවෙන් ම බොහෝ නැමි වර්ග අධ්‍යයනයට උදාහරණ සොයා ගැනීමට පුළුවන්.
sample_158579|අනෙක් අතට නැමි වර්ග ගවේෂණය කිරීමට මැටි වර්ණ කර තට්ටු වශයෙන් තබා දෙපසින් විවිධ ආකාරයට
sample_158580|පාසල් සිසුන්ට අධ්‍යාපන ප්‍රදර්ශන සඳහාත් කණ්ඩායම් ව්‍යාපෘති සඳහාත් මෙවැනි දේ කළ හැකි අතර ඒ ආදර්ශ බාල
sample_158581|හැබැයි වොද්කා වලට නොවේ, පසුව ආපු අමෙරිකාන්ස්කියි සියයට සියයක් ස්ප්‍රිතු වලට
sample_158582|ජැප්පගේ නම ඉසාමි කොන්ඩෝ බවට මේ දැන් ඊතලයක් ලැබුණි.
sample_158583|ජැප්පා එහෙම වුණත්, ජෙප්පන් නම් මේ ලෝකයේ දෙයක් ඉගෙන ගන්න පිරිසක් නොවේ.
sample_158584|අඩුම ගානේ තමන් කතා කරන මිනිසුන් කොයි වගේද කියලවත් අවබෝධයක් ගන්න ගෙදර වැඩ ටිකක් කරලා වරෙන්කො.
sample_158585|ඒ වගේම අපට හිටිය ගුරුවරුන්, අනෙක් රටවල් වල සිසුවන් හා ඉගැන්වීමේ ක්‍රමය ගැනත් මාත් ලියන්න නම්
sample_158586|නමුත් මා පළමු අවුරුද්දේ දී හිටපු නේවාසිකාගාරයේ සිට, එයිට කිලෝමීටර ගණනක් එහායින් තිබුණ ඉංජිනේරු නේවාසිකාගාරයට ගිහිං,
sample_158587|ජෙප්පගේ පිටි පස්සේ ඔච්චර ගියේ මොකද කියල මට තේරෙන්නේ නැහැ.
sample_158588|හැත්තෑ එක කැරැල්ල ආරම්භයේ සිට අවසානය දක්වා පුර්ණ සමාලෝචනයක් කෘතිය
sample_158589|ඒ කඳු අතර දැවැන්ත නැමි කඳු සුවිශේෂි තැනක් ගනී.
sample_158590|ඇත්ත කතාව ඕකද? ඒ දවස් වල කොපයේ කෙනෙක් විරුද්ධ වුන නිසා වීසා නොලැබුණු බවයි කියන්නේ.
sample_158591|අසූ අට අසූ නවය කාලයේ විජේවීර මහතා එයට වාඩුව ගත් බවට කතාවකුත් ඇහුව.
sample_158592|සියලු දේශපාලන දර්ශනයන් හා පරමාදර්ශයන් නවතන බලය වූ ලිංගිකත්වය හා ලෝකය දැකීම යන කරුණු මත
sample_158593|එකම දර්ශණය වුව කාලය අනුව වෙනස් විය යුතුය යන අප අනුගමනය නොකරන දහම තවදුරටත් වලංගු නොවන
sample_158594|තවදුරටත් වලංගු නොවන බවට එය වලංගු නැත මම කළා හරිද?
sample_158595|මේ සෝවියට් දේශයේ ස්ටාලින් ගේ කාලයේ තිබු මර්දනය හා සමාන කාලයකි.
sample_158596|විජේවීර සමහර වෙලාවට ලෝක දේශපාලනය තමන්ගේ වුවමනාවට අනුව කියෙව්වද කියල හිතෙන අවස්ථා ගොඩක් තියෙනවා.
