sample_158704|නමුත් චන්ද්‍රිකා මහත්මියට පාසල් පෙළ පොත් මතක් වූයේ එවැනි හැඟීමක් ඇතිව කුට්ටිගල සේන
sample_158705|ගමගේ ඕමල්පේ ප්‍රගීත් ජනක උපුටා ගැන්ම දිවයින කුරා කූහුඹියකුටවත් වරදක් නැති අහිංසක මගේ වස්තුවට පොලිසිය
sample_158706|එපා කියලා කෑ ගහද්දී මගේ වස්තුව බිමට අපගේ රණවිරුවන්ට එරෙහිව පවත්වන්නා වූ නඩු විභාග හා
sample_158707|දෙදහස් දහය ජනවාරි මස ජනමාධ්‍යකරුවෙකු වූ ප්‍රගීත් එක්නැලිගොඩ මහතාගේ
sample_158708|මෙම විශේෂ බුද්ධි අංශ නිළධාරීන්ගෙ සමන් ගමගේ උපුටා ගැන්ම දිවයින විලංගුලා සිටින බුද්ධි අංශ නිලධාරීන්ගේ
sample_158709|කුමක්දො වේදනාවක් සමග ධර්මන් වික්‍රමරත්න මේ දිග හැරෙන්නේ ජවිපෙ දෙවැනි කැරළි සමයේ ලෙයින් තෙත්වූ යුගයක
sample_158710|මේ පණ පොවන්නේ එක්දහස් නවසිය අසූ හය සිට එක්දහස් නවසිය අනූව දක්වා ලෙයින්
sample_158711|මේ පන්නරය ලබන්නේ යහපත් හෙටක් වෙනුවෙන් කිසිදු ලාභ ප්‍රයෝජනයකින් තොරව සිය ඇස්, ඉස්, මස්, ලේ සහ
sample_158712|මේ ජවිපෙ දෙවැනි කැරැලි, පෝස්ටඩ් ඉන් ධර්මන් වික්‍රමරත්න
sample_158713|දන්නවද හුස්ම ගැනිමයි අපිට දැනෙන හැඟිමුයි අතරේ තියන්නේ නොබිඳිය හැකි යාලුකමක්.
sample_158714|අපි හුස්ම ගන්න රිද්මය වෙනස් වෙනවා අපිට දැනෙන හැඟිම් එක්ක.
sample_158715|හරියට හිරුත් එක්ක අපේ හෙවනැල්ලේ දිග පළල වෙනස් වෙනවා වගේ.
sample_158716|මම අද කියන්න යන්නේ මෙන්න මේ වෙනස අනිත් පැත්ත හරව ගන්න විදියක් ගැන.
sample_158717|ඒ කිව්වේ කොහොමද හුස්ම ගන්න රිද්මය භාවිතා කරලා අපේ හැඟිම් වඩා හොඳ අතට හරව ගන්නේ කියලා.
sample_158718|සමහර වෙලාවට අපිට දැනෙන හැඟිම් පාලනය කර ගන්න හරිම අමාරුයි.
sample_158719|අපිට තරහ ගියාම, කලබල උනාම කතා කරගන්නත් බැරි වෙන, සමහරදාට නිදාගන්න ගියාට පැය ගානක් එහාට මෙහාට
sample_158720|හැබැයි අපිට පුලුවන් හරිම ලේසියෙන් අප හුස්ම ගන්න රටාව හිතා මතා වෙනස් කරගැනිමෙන් මේ අකීකරු කියන
sample_158721|හරියට කරනවා නම් හුස්ම කියන්නේ බොහොම බලගතු ආයුධයක් මනස පාලනයට තියන.
sample_158722|ගොඩක් වෙලාවට ඉබේ සිදුවෙන ක්‍රියාවලියක් නිසා අපේ අවධානය හුස්ම ගැනීම ගැන යොමු වෙන්නේම නැති තරන්.
sample_158723|පහුගිය කාලේ නිකන් ලැබුනු සහනාධාරත් අපතේ ගියේ හරි කලමණාකරනයක් නැති නිසා.
sample_158724|ඔබ දන්නේ නැති උනාට ගොඩ දෙනෙක් හුස්ම ගන්නේත් වැරදියට
sample_158725|ඒ වගේම හරියාකාරව ගන්න හුස්ම තමයි ලොකුම රහස නිරෝගිකමෙත්,
sample_158726|අපි පොඩි කාලේ නිදා ගන්න ඇඳට ගිහාම බිත්තියේ තිබ්බ ඔරලෝසුවේ තප්පර කට්ට එක්ක ඔට්ටු අල්ලනව
sample_158727|අපිට හැකි නම් හරියාකාරව හුස්ම ගැනිම පාලනය කරන්න එතුලින් අපේ ආහාර ජීර්ණය හා විවේකයට හේතු වන
sample_158728|ගොඩක් වෙලාවට අපේ හිතේ ඇතිවන අසහනකාරි තත්වයන් ගැඹුරු හුස්ම ගැනිමත්
sample_158729|ඒ වගේම විනාඩි පහක් වගේ කාලයක් තුල වරකට එක් නාස් කුහරය බැගින් භාවිතා කර ගැඹුරු හුස්ම
sample_158730|මේ වගේ දිනපතා අනිත් දිනචරියාවන් වගේම හුස්ම
sample_158731|ඔබත් විනාඩියක් හෝ මෙය අත්හදා බලා දැනෙන හැඟිම මෙහි සටහන් කර යන්න.
sample_158732|ඔබ මෙය කියවා ප්‍රයෝජනය ගත හැකි කෙනෙක් බව හිතෙනවා.
sample_158733|මගේ ජීවිතයේ පළමු විශේෂ මෛත්‍රි භාවනාවත් සිදු වු අසාධාරනය නිසා හිතේ හට ගත් නොසන්සුන් හැඟිමුත් මෙවැනි
sample_158734|ඔහු හැමවෙලේම අපිට පුරුදු කලා අවට පරිසරයේ සිදුවන සිදුවිම් වලින් අපේ මනසේ සාමයට හානි කර නොගෙන
sample_158735|අද වෙනකොට මෙම ක්‍රම ඉතාම සාර්ථකව මගේ ජිවිතය සැහැල්ලුවෙන් ගෙනියන්න භාවිතා වෙනවා.
sample_158736|ටිකක් වැඩිපුර වෙලාවක් තියෙන විටක මම දීල තියෙන ලින්ක් එකේ තියෙන පෝස්ට් එක කියවන්න.
sample_158737|වැදගත් කියවන්න ආස හිතෙන හරවත් දෙයක් හම්බුනාම ඒ වෙලාව තමයි ඉයන් මගෙ වැඩිපුර ඉඩ තියන වෙලාව.
sample_158738|මේ සරල දෙය වටහා ගන්න ගොඩක් දෙනෙකුට බැහැ ඉයන්.
sample_158739|පුලුවන් විදිහට තමන්ගෙ ජීවිතය තුලින් අන් අයට මේ සරලත්වය පෙනෙන පරිදි ජීවත්වීම මිස පැහැදිලි කරදෙන්න යන
sample_158740|තම තමන් රැස් කල දැ තම තමන් ගෙන යාවි.
sample_158741|මට මේක කියවනකොට මතක් උනේ ශෂිකා නිසන්සලාගේ හුස්මක් දුරින් ඉන්න මට බෑ ඉතින් කියන සිංදුව චතූ.
sample_158742|හුස්ම ගන්න එක නිරායාසයෙන්ම වෙන නිසා ලැබෙන වාතයත් නිකන්ම නිසා මිනිස්සුන්ට ඒ ගැන වටිනාකමක් නෑ.
sample_158743|දිනේශ්, මම ජාලයේ පින්තූර හොයද්දි තමයි මුලින්ම තියන පින්තුරය දැක්කේ.
sample_158744|ඒ වෙලාවේ මෙහෙම ලියන්න අදහසක් තිබ්බේ නැති උනත් මම ඒක සේවු කර ගත්තා.
sample_158745|මේ සතියේ මට මේ ගැන ලියන්න හිතුනම මෙතනට යොදා ගත්තා.
sample_158746|දෙදහස් දහසය ජුනි දහසය, පෙරවරු දොලහයි දහනවය ලලිත් කියවල තියනවද
sample_158747|එහි එන සේවිකාව එක එක පාට එක එක රටාවට ඇති එලවලු කපන්නෙත් මේ වගෙ
sample_158748|රාමෙන් ගර්ල් කියන ෆිල්ම් එකෙත් හිත සන්සුන් කරගැනිම ගැන කතා කරනවා.
sample_158749|ඇස් දෙක වහගෙන කරනවනම් සම්පූර්ණයෙන් සුදු කොන් නොපෙනෙන තිරයක් දිහා බලාගෙන ඉන්නවා වගේ ඉන්න.
sample_158750|ඇස් ඇරගෙන කරනවානම් ඈත තියෙන ගසක් දිහා තත්පර කීපයක් බලාගෙන සිට ගස අපැහැදිලි වෙන සේ ටිකක්
sample_158751|ඉයන්, මම කරල බලන්නම්, මම පොඩි කාලේ ඉඳලා කරන් දෙයක් තමයි ඇස් වහගෙන නලළ හරියට
sample_158752|ගැඹුරු හුස්මක් ගැනීම හොදයි කියලා අහලා තිබ්බත් නාස්පුඩු මාරුවෙන් මාරුවට වසා හුස්ම ගැනීම පිට කිරීම ගැන
sample_158753|මම මුලින්ම මේ හුස්ම ගැනිමේ ක්‍රමය කියෙව්වේ දෙදහස් දහය,
sample_158754|අපි හුස්ම ගන්නවා කියල කරන්නේ අවට වාතයේ තියන ඔක්සිජන් ඇඟ ඇතුලට ප්‍රවාහනය කිරිමනේ
sample_158755|හරි සම්පුර්ණ හුස්මකදි අපේ උදරයත් පිමිබිය යුතුයි, උරස් කුහරය පමණක් නොවේ.
sample_158756|කරල බලන්න ඔබ හුස්ම ගන්න කොට ඉහළ පහල යන්නේ උරස් කුහරය පමණද, උදයරත් උස පහත් වෙනවද
sample_158757|හරියට හුස්ම ගැනිමෙන් හැඟිම් විතරක් නෙමේ, අපේ කම්මැලිකමත් පාලනය කල හැකියි.
sample_158758|ඔබ කියනා ලෙස ගැඹුරු හුස්ම ගැනීමෙන් මනස ඒකාත්මික කිරීම මා අත්දුටු සත්‍යක්.
sample_158759|දෙදහස් දහසය ජුනි දහසය ,පස්වරු අටයි දාහතර ඔබට ස්තුතියි
sample_158760|මේ ක්‍රම පුරුදු කරන අය එක්ක ඉන්න හරිම ලේසියි,හොස්ස ලඟින් මැස්ස යන්න බැරි අයව මෙහෙම ක්‍රම
sample_158761|අපේ සිරුරෙ සියලු ක්‍රියාකාරකම් වල රිද්මය හෑසිරවීමේ බලය, හුස්ම තුල හෑන්ගිලා තියෙනව කියලා මට හිතෙනවා.
sample_158762|මේ දවස්වල වාතාවරණය හැටියට මේ ලිපිය ලොකුම ලොකු උදව්වක, නිම්නයක තනි වී හීන දකින්නී.
sample_158763|දෙදහස් දහසයේ ජුනි දාහත, පස්වරු එකොලහයි හතලිස් පහ උදව්වක් උනා නම් හරිම සතුටුයි.
sample_158764|ඒත් දැන් මං ගැඹුරු හුස්ම විසඳුමක් විදියට හොයන් ඉන්නෙ.
sample_158765|ඒකට හිත යොමුවුණාම මට තරහ ගැන හිතන්න අමතක වෙනව මටත් එහෙම කාලයක්
sample_158766|ඒත් මං කියන නිහඬ කාර්යබහුල සැමියා නිසා සැහෙන්න ඒ පුරුදු අඩු උනා.
sample_158767|දෙදහස් දහසයේ සැප්තැම්බර් දාහතර පස්වරු හතරයි හතළිස් අට හීන හොයන්න මම යන තැන්.
sample_158768|අහසෙන් එන්න කුරුටු ගෑ ගී පවුර ඈ සුජීවා නම් විය.
sample_158769|ලාංකීය සිතුවිලි ලංකා වෙබ් ගොවිජන අරගලය ජනාධපති මෙෙත්රීපාල සිරිසේන මහතා පලවා හැරීම, ඉලක්ක කරගත්
sample_158770|ඒ සමගම රටපුරා ගොවිජනතාව එකවරම වීදි බැස සටන් මෙහෙයවයි.
sample_158771|මේ දේශපාලන නාටකයේ, යහපාලනයේ දෘෂ්යමාන නිර්මාතෘවරුන් වන එක්සත් ජාතික පක්ෂය, චන්ද්රිකා කුමාරතුංග මහත්මිය ඇතුලු ශ්රී ලංකා
sample_158772|මේ සිදුවීම්, පෙල ගස්සන විට අපට අපූරු චිත්රයක් මැවී පෙනේ.
sample_158773|මේ චිත්රයෙන් අපට කියා පාන්නේ ජනතා විමුක්ති පෙරමුණ සිය දෙවන කොන්තරාත්තුව ආරම්භ කර ඇති බවයි.
sample_158774|එය ජනාධිපති මෙෙත්රීපාල සිිරිසේන මහතාට එරෙහිව සිදු කරන බවත් එහි අරමුණ එතුමාව ජනාධිපති කමින් පලවා හැරීමේ
sample_158775|ගැටලුව නිර්මාණය වූයේ, මුදල් ඇමතිතුමා පොහොර සහනාධාරය කප්පාදු කල බැවිණි.
sample_158776|කප්පාදු කල විගසම ජනතා විමුක්ති පෙරමුණ සිදුකලේ,ගොවිජනතාව ඊට විරුද්ධව මහපාරට බැස්සවීමය.
sample_158777|මෙය ගොවි ජනතාවගේ ජයග්රහණය උදෙසා සිදු කරන අරගලයක් නම්, පලමුව තමන්ගේ සහෝදර යහපාලන මුදල්
sample_158778|අගමැතිතුමා සමග සාකච්ඡාවක් ඉල්ලා මේ ගැටලුව විසදා ගැනීමට වෙර දැරිය යුතුය.
sample_158779|ජනාධිපතිතුමා සමග සාකච්ඡාවක් ඉල්ලාගෙන මේ ගැටලුවට විසදුමක් ලබා ගැනීමට වෙර දැරිය යුතුව තිබුණි.
sample_158780|එයත් අසාර්ථක වුණි නම් පමණක් කල යුතුව තිබුණේ, නමුත් එසේ සිදු නොවීය.
sample_158781|එසේ සිදු නොවුණේ ඇයි? අප දන්නා තරමින් මුදල් ඇමතිතුමාගෙන් සාකච්ඡාවක් ඉල්ලා සිටියේවත්, එවැනි සාක්ඡාවක් පැවැත්වුනේවත් නැත.
sample_158782|මින් පැහැදිලිවන්නේ, මේ පොහොර සහනාධාරය කපා හැරිය මුදල් ඇමතිතුමා සමග සාකච්ඡාව, එතරම් වැදගත් කටයුත්තක් ලෙස සැලකීමට
sample_158783|තවද, ගරු අගමැතිතුමා සමග හෝ ගරු ජනාධිපතිතුමා සමග සාකච්ඡාවක් ඉල්ලා සිටි බවක්වත් සාකච්ඡා කල බවක්වත් එතුමන්ලා
sample_158784|නැවත වරක් ඒ ඇයි? යන පැනයම ඉස්මතුවන අතර, පැහැදිලි පිලිතුර වන්නේ, පොහොර සහනාධාරය නැවත ලබා ගැනීමට
sample_158785|එසේ නම් ඒ සැලැස්ම කුමක්ද? ජාත්යන්ත්රණ දේශපාලනයේ පමණක් නොව ජාතික දේශපාලනයේද අපි විරුද්ධ වෙ නම්, ඔයගොල්ලො
sample_158786|මෙහි සිදුවන්නේද ඒ දේශපාලනයම බව සිදුවෙන සිදුවීම් පෙන්වා දේ.
sample_158787|ඒ අනුව මේ ගොවිජන අරගලය, කලින් සූදානම් කරගත් න්යාය පත්රයකට අනුව ආරම්භකර ඇති බව අපට පිලි
sample_158788|එවිට මෙය එක්සත් ජාතික පක්සයේ හා ජනතා විමුක්ති පඑරමුණ යන සුසංයෝගයේ නිර්මාණිතයකි.
sample_158789|පොහොර සහනාධාරය කපා දැමීම එක්සත් ජාතික පක්ෂයේ මුදල් ඇමතිවරයා විසින් දියත් කරන විට, ජනතා විමුක්ති පෙරමුණ
sample_158790|එසේ නම් මේ ගොවිජනතාව පාරට දමාගෙන ඔවුන් සිදුකරන්නේ කුමක්ද? වර්තමානයේ මේ සිදුවෙන දෙය අපව, ඉතිහාසයේ එක්දහස් නවසිය පනස් තුන
sample_158791|ඒ සිදුවීම හා සිදුවූ ආකාරය වර්තමානය යලි සලකා බැලීම වටී.
sample_158792|සේනානායක පරපුර යනු අධිරාජ්ය ගැති පරපුරක් නොවීම සේනානායකලාට මහත් කරදරවලට මුහුණ දෙන්නට සිදුවූ එක් හේතුවකි.
sample_158793|පුරවැසි පනත ගෙන ඒම තුලින් ඉන්දීය ඦාතිකයින්ට මෙරට උරුමව තිබූ චන්දය පාවිච්චි කිරීමේ වරම අහෝසි කිරීම.
sample_158794|මෙරටට අති වැදගත් බාරධූර කටයුතු වලට අත ගැසීම එතුමාගේ අගමැති ධුර කාලය වසර තුනකට සීමාකරන්නට
sample_158795|මහා දුර දක්නා නුවණක් තිබූ එතුමා සිය ඥාණ ශක්තියෙන් අනාගත ලංකාව මුහුණ දෙන බරපතල ගැටලු නිවැරදිව
sample_158796|ඉදිරිය දැකීම තමන් දුටු ඒ අනාගතය සුමගට ගැනීමට කටයුතු කිරීම, ඔහු කල වරද වූ අතර, ඔහුගේ
sample_158797|අගමැති ඩඩ්ලි සේනානායකව පලවා හැරීම සදහා මුදල් ඇමති
sample_158798|ජයවර්ධන මහතා සහල් මිල ඇතුලු අත්යවශ්ය ආහාරවල මිල සියයට සියයකින් කින් ඉහල දැමුවේ එයින් ඇතිවන පීඩනය සම්බන්ධව
sample_158799|එදා මුදල් ඇමතිවරයා භාණ්ඩ මිල ඉහල දමන විට වාමාංශික ව්යාපාරය ඒ සමගම හර්තාලය ආරම්භ කරන ලදී.
sample_158800|මුලු රටම නැගිට්ටේ විප්ලවීය ආකාරෙන් මුලු රාජඅය බලයම අත්පත් කරගන්නා ආකාරයෙණි.
sample_158801|පොලිස් වෙඩි පහරින් හර්තාලයට සහභාගිවූවන්ද මියගිය අතර,අගමැති ඩඩ්ලි සේනානායක මහතාට බටහිර උපදේශකයින් දන්වා සිටියේ අගමැති ධූරයෙන්
sample_158802|වර්තමානයේදී, අධිරාජ්යවාදීන් මෙෙත්රීපාල සිරිසේන මහතාගෙන් ගත හැකි උපරිම ප්රයෝජන ලබාගෙන හමාරය.
sample_158803|තවදුරත් සුදු අලියෙක් නඩත්තු කරමින් සිටීමට ඔවුන් සූදානම්ද නැත.
sample_158804|එය සිදු කිරීමට නම්, මෙෙත්රීපාල සිරිසේන මහතා එම ධූරයෙන් ඉල්ලා අස්වෙන තත්වයට සමාජවාතාවරණය ගොඩනැංවිය යුතුය.
sample_158805|වර්තමාන ගොවි ජන අරගලය විසින් සිදු කරන්නේ එම කර්තව්යයි.
sample_158806|ශ්රී ලංකා නිදහස් පක්ෂය කඩාගෙන යාමට බලවත් සූදානමක් ඇත.
sample_158807|ඒ පීඩනයන් හේතුවෙන්දෝ ප්රසිද්ධ රැස්වීම් වලට ආරාධනා කලවුන් සමගද ගැටලු ඇති කර ගනී.
sample_158808|මේ සිදුවෙමින් ගලා යන ක්රියාවලියන් තුලින් ජනාධිපතිතුමා බලවේගයක් නොව තනි පුද්ගලයකු බවට පත්ව අන්ත අසරණ තත්වයකට
sample_158809|ගොවිජන අරගලය ජනාධපති මෙෙත්රීපාල සිරිසේන මහතා පලවා හැරීම, ඉලක්ක කරගත් කුමන්ත්රණයක්ද?
sample_158810|පණ්ඩිතගේ මහතා ඩී ඇස් ගැන නගා ඇති වර්ණනාව මෙලෙසම කරන් බොහෝ දෙනා මට හමුවී තිබේ.
sample_158811|එහෙත් ධර්මසිරි සෙනෙවිරත්න මහතා ඉන්නේ බොහෝදුරට මීට ප්‍රතිවිරුද්ධ අදහසකය.
sample_158812|ඩී ඇස් කල ජනපද පිහිටුවීම වෙන කිසිම ජනනායකයෙක් අදවෙනතුරුත් කොට නැත.
sample_158813|මේ අතින් මහින්ද රාජපක්ෂ මහතා යුද්ධය නිමාවුවද, මෙය මග හැරීමෙන් ඉතාම පහලම අගැයීමකට වැටේ.
sample_158814|ඔබ දෙපල ඩී ඇස් ගැන අප තවදුරටත් දැනුවත් කරතොත් මැනවි.
sample_158815|ඉන්දියානුවන්ට බනින කිත්සිරි මහතා ගේත් මේ කාරනය පිලිඹද මීට වඩා තර්කානුකූල කරුනු අවශ්‍යයි.
sample_158816|අවුරුදු පනහ කට පෙර සිටි බණ්ඩාරනායකට දොස්කීම නවතා, මහින්ද රාජපක්ශ මහතා පසුදිය අවුරුදු පහ
sample_158817|ලෝකය මොනවා හිතනවද කියලා රට ආගදයට යන කම් පාර්ලිමේන්තු මන්ත්‍රී තපස් රකින්න ඕනි කියලා හිතන අයට.
sample_158818|අපේ පාර්ලිමේන්තුව හොඳයි බං ශ්‍රී ලංකාව තුල යුක්රේන මොඩලයේ බල හුවමාරුවක් ගෙන ඒමට විදෙස් ඔත්තු සේවා
