sample_159283|ෂර්ලොක් හෝම්ස් කතාවක් සහ එක්ස් ෆයිල්හි එක කොටසක් මේ විදියට පරිවර්තනය කරන්න මාත් උත්සාහ කලා.
sample_159284|පුදුම සතුටක් දැනෙනවා එහෙම අපි ලියපු උපසිරැසි එක්ක ආයෙ බලනකොට.
sample_159285|ඒත් ලියපු ටික ප්ලේ වෙනකොටනම් දැනෙන සතුට කියාගන්න වචන නෑ.
sample_159286|ඒ නිසා අනිවාරෙන්ම කතාව නරඹන ගමන්මයි මේ වැඩේ කරන්න වෙන්නෙ.
sample_159287|ඒකයි මං කලින් රාණි ෆිල්ම් එක මහී සබ් කරල ගෙනාව වෙලාවෙත් කිව්වෙ
sample_159288|ඇත්තෙන්ම කිසිම ලාබ ප්‍රයෝජනයක් නැතිව මේ ගන්න මහන්සියට මල් පුදන්න වටිනවා.
sample_159289|ඇත්තම කියනව නම් මනෝ අපි සබ් කරන ෆිල්ම් බැලවෙන්නෙ නැති තරම්.
sample_159290|මොකද අපිට එහෙම සබ් කරපුවාම ෆිල්ම් එකේ රසයක් නැතිව යනව.
sample_159291|ලිපිය වටිනවා වුණත් මට මුකුත් පැහැදිලි නෑ.
sample_159292|ඔයා කියනව නං ඇත්ත වෙන්න ඇති නෙව.
sample_159293|මමයි තව කොල්ලෙකුයි එකතු වෙලා මෙක කරන්නෙ
sample_159294|මම හිතුවේ නෑ එස්.ආර්.ටී. ෆයිල්, නෝට්පෑඩ් එකෙන් අරින්න පුලුවන් කියලා.
sample_159295|කොහොමත් මම ඔය සිංහලෙන් සබ්ටයිටල් දාන වැඩේ නම් කරන්න අදහසක් නෑ
sample_159296|කාට හරි ප්‍රයෝජනවත් වේ නම් එපමනයි.
sample_159297|බැලූ බැල්මටනම් ටිකක් සංකීර්ණයි වගේ පෙනුනට පුරුදු උනාම අවුලක් නෑ වගේ.
sample_159298|ඇත්තටම ඒක පුරුදු වුණාම ඒ කරන්න ඕන වැඩ ටික ඔටෝම වෙනව.
sample_159299|වැඩේ පට්ට සීරියස් වගේ තේරුණාට බැහැලා බැලුවම ලේසි
sample_159300|ගුරු මුෂ්ටි තියන් මේ වගේ වැඩ කරන්න බෑ ප්‍රියා.
sample_159301|කෝ අනේ අර ස්මරණ කතාව? දැන් ලියන්නේ නැද්ද? මේ දවස් ටිකේ ටිකක් විතර බිසී වුණා.
sample_159302|අර ඉංග්‍රීසි අදහස කොහොම කරත් සිංහලෙන් ලිව්වම ටිකක් දිග වැඩි වෙනවා.
sample_159303|එහෙම වුනාම තිරයේ දිස්වන වෙලාව වෙනස් කලොත් දිගටම ඒ වෙනස ඉදිරියට ගෙනියන්න වෙනවා නේද?
sample_159304|ඒ හිංද තමා සමහර දිග වාක්කිය පේලි දෙකකට අරං තියෙන්නෙ.
sample_159305|සමහර විට පේළි තුනකට කැඩෙනව ඒත් ටයිම් ලයින් වෙනස් කරන්නෙ නෑ.
sample_159306|අනික තමා ගොඩක් දිග වාක්‍යයක් වුණත් ඒකෙ තියෙන නම් ගම් හැර අදහස කෙටි කරල ගන්න පූලුවන්.
sample_159307|විචාරක තුමාට අපහැදිලි නම් අහන්න ඕන දෙයක් කියල දෙන්නං
sample_159308|ඒකෙ එක දෙක තුන හතර හතර කියල තියෙන්නෙ ලයින් අනු පිළ වෙල.
sample_159309|ඔයාට පුළුවන් නම් එස්.එස්.එස්. එඩිට් කරන්න පුළුවන් විදිහක් කියන්න.
sample_159310|ෆෝන් කට්ටක් එක්ක ඔට්ටු වෙවී ඉදල මම වින්ද දුකක්.
sample_159311|මම ඔබට කියන්න යන්නෙ අපූරු කතාවක් ගැන.
sample_159312|අපි දෙන්න වාඩි වෙලා හිටියෙ මූණෙන් මූණ බලාගෙන.
sample_159313|සුනිල් ගෝවින්නගේ පද්‍ය නිර්මාණ මතකයේ රැඳුනු තැන්.
sample_159314|ටිකක් හිතන්න කුරුටු ගෑ ගී පවුර මල් අඩවියට සාදරයෙන් පිළිගනිමු.
sample_159315|පුතේ මං උඹට මගේ කණ්ණාඩි දෙක දෙන්නෙ නෑ.
sample_159316|හෘද සාක්ෂියක් ඇති ශ්‍රී ලාංකික මිනිසුන්ගේ දේශපාලනික සංස්කෘතික අවකාශය.
sample_159317|චන්ද්‍රරත්න මානවසිංහ අමල් පෙරේරා සමග උරේෂා රවිහාරි.
sample_159318|අජිත් කුමාරසිරි ගයන ග්‍රීස් ගහේ මුදුනට ම ගියා මම සම්මත ගීත ආකෘතිය ඉක්මවා ගිය ගීතයකි.
sample_159319|සවන් දෙන්න මේ අමිහිරි මතක අතීතයක සිට එන අන්තිම දුම්රියයි
sample_159320|මම මෙහෙ ජීවත්වෙන්න ගත්ත පළමු අවුරුද්දෙම මාව තුවක්කුවක් පෙන්නලා බයකලා
sample_159321|සහවේදනීය පරිකල්පනය ගැන සාහිත්‍ය කලා ක්ෂේත්‍රයේ නොයෙක් දේ කතා වේ.
sample_159322|බියෙන් අත්මිදෙමු නමින් මේ නොවැම්බරයේ දහඅට වැනිදා සවස හයට
sample_159323|අනුරාධපුර ශාන්ත ජෝශප් දෙව්මැදුර රංගශාලාවේ ඔබේ ගීතමය ප්‍රසංගය පැවැත්වෙනවා.
sample_159324|හඬක් නැති මිනිසුන් වෙනුවෙන් නැගෙන ගී හඬ
sample_159325|වරක් පේරාදෙණිය විශ්වවිද්‍යාලයේ මහාශිෂ්‍ය සංගමය විකල්ප සංගීත සැඳෑවක් පැවැත්වීය.
sample_159326|එහිදී ගීතදේව, පියල්, ශාක්‍ය වැනි අය ගැයූ ගී නිසා මම ප‍්‍රීතියෙන්.
sample_159327|මම අවස්ථාවාදියෙක් නම්, මටත් අද ලොකු තනතුරක් ලැබිලා.
sample_159328|වර්තමාන කලාකරුවන්ගෙන් ඇතැමෙක් අද දේශපාලන ඇම්බැට්ටයන් වෙලා.
sample_159329|අමරදේව මහත්තයගේ උපන් ගමෙන්ම කතාව පටන් ගනිමු.
sample_159330|පොඩි කුමාරිහාමි වලව්වෙං ගියොත් මම ආයෙ මේ පැත්ත පළාතෙ එන්නෙ නැහැ.
sample_159331|ඒත් මටනම් තේරෙන්නෙම නැත්තෙ නීති වැඩ ගැන උපදෙස් ගන්න වෙනම කෙනෙක් මොහොකට කියලා.
sample_159332|මම නීතිය ඉගෙන ගත්තෙ අලුත්කඩේ උසාවියෙං
sample_159333|හැබැයි ඔය ලෝයර්ලයි කියන අයට වඩා නීතිය ගැන මම දන්නව
sample_159334|හැමෝම දන්නව ඇතිනෙ පහු ගිය සතියේ සිදුඋනු සිදුවීම ගැන.
sample_159335|මේ වලව්ව ඇතුලට කොහෙදෝ යන හෙනහුරෙක් පිටින් පාත්වෙලා
sample_159336|දන්නවනෙ අපෙ පරම්පරාව ඇහැලේපොල මහ නිලමේ ගෙන් පැවත එන කන්ද උඩරට ප්‍රභූන් අතර.
sample_159337|තමන්ගෙ ආදරවංතයාට උනත් වාසියක් වෙනවට කැමති නැහැ.
sample_159338|මට ඒ වාක්කිය ඉවර කොරන්ඩ හම්බ උනේ නැහැ.
sample_159339|මහ කුමාරිහාමිගෙ ගර්ජනාවට මම උඩ ගිහිල්ල වහලෙ හැප්පිල ආයෙ බිම වැටුන.
sample_159340|මහ කුමාරිහාමිට පිස්සු වත් හැදිලද? නැත්නම් දෙය්යෝ සාක්කි මොකදෑ
sample_159341|දයාවතී, අරං එනව මගෙ ප්‍රෙසර් පෙති, වතුර එකකුත් එක්කලා ලොකු කුමාරිහාමි පෙති දෙකක් තුනක් බිව්ව වතුර
sample_159342|මේ කවිකාරගෙ වැඩ නිසා මම දන්නව වෙලාවක මගෙ ප්‍රෙසර් එක වැඩි වෙලා මහ විනාසයක් වෙනව
sample_159343|සියලු ඉල්ලුම් පත් ජායාරූපයක් සමග මහ කුමාරිහාමි වෙත යොමු කරන්න
sample_159344|ඒ නිසා සතියක් විතරම වලව්ව පැත්ත පලාතෙ යන්න බැරි උනා.
sample_159345|ඔන්න අර මහා රැස්සීමෙං සතියකට විතර පස්සෙ මයෙ හිතේ.
sample_159346|ආ, කවිකාර, එමු, එමු මෙහාටම, මම මේ පයිංඩයක් යවන්ඩමයි හිටියෙ මේ පැත්තෙ එන්ඩෙයි කියල
sample_159347|පින්න මල් පොකුරක් වගෙ හිනාවේගන එයා අපි ලඟට ආවා.
sample_159348|අත්තම්මේ, මම ජිම් යනවා ලොකු කුමාරිහාමිගෙ මූණ ඉඹල එහෙම කිව්වා.
sample_159349|කවිකාරටත් ඕනද උම්මා එකක්? ඒ කරල මං දිහා බලල හිනාවෙවී ඇහුවා.
sample_159350|මයෙ මූණ විතරක් නෙවෙයි ඉහේ ඉඳන් දෙපතුල දක්වා රතු වෙලා ගියා ඔන්න.
sample_159351|පොඩ්ඩි, යනව යන දිහාවක මෙතන කෝලං කරන්නෙ නැතුව
sample_159352|ඔය නිසාම තමයි මම අර බොඩි ගාඩ් කෙනෙක් පත් කරන්න තීරණය කලේ
sample_159353|ඉතිං කාවද පත් කරන්නෙ? ලොකු කුමාරිහාමි කනස්සලු මූණකින් කිව්වා.
sample_159354|ඒ නිසා මේ තනතුරට සුදුසු කෙනෙක් හෙටම හොයාගෙන එන්න ඕනෙ.
sample_159355|දැන්ම ගිහින් සුදුසු කෙනෙක් ගැන හොයන්ඩ හොඳයි ලොකු මැණිකෙ මට කතා කරන්ඩවත් දුන්නෙ නැහැ.
sample_159356|දැන් ඔන්න ඔය සමණල ආචරණය ක්‍රියාත්මක වෙන්නෙ මෙන්න මෙහෙමයි.
sample_159357|ඔහු කීපදිනක්ම ඇගේ නිවෙස අසල තම යතුරු පැදියේ නැඟී
sample_159358|අද එයා හම්බ උනේ නැත්නම් මේ වැඩේ අල්ලල දාන්න ඕන.
sample_159359|යාන්තම් සුව අතට හැරුණු පසු ඇය අද සවස මේ සූදානම් වූයේ අසල වසනා මිතුරියක හමුවීමටයි.
sample_159360|ඇගේ පියා එදිනෙදා කුළී වැඩට ගොස් උපයාගන්නා සුළු මුදලින් යැපුණු බැවින් ඔවුන් ගෙවූයේ අග හිඟ කමින් පිරි දිවියකි.
sample_159361|ඇය සහ ඇගේ සොයුරිය පාවිච්චි කලේ එකම සෙරෙප්පු යුවලකි.
sample_159362|නිවසේ වූ එකම කාමරයේ සෑම තැනම සොයා ද සෙරෙප්පු යුවල සොයා ගත නොහැකිවූ පසු ඇය කුස්සියට ආවා ය.
sample_159363|කෝ අම්මෙ අර කළු පාට සෙරෙප්පු දෙක? ඇයි මේ කොහෙ යන්නද?
sample_159364|කවුද මන්ද අක්කෙ මෝට සයිකල් කාරයෙක් හිටිය අතන දෙවට ගාව.
sample_159365|මේ දවස් දෙක තුනේමත් මේ පැත්තෙ කැරකුන වගෙ මට මතකයි.
sample_159366|අවසන් වරටත් ඇගේ නිවස දෙස බලා තම යතුරු පැදිය පණගන්වාගෙන එතැනින් නික්ම ගොස් තිබිණි.
sample_159367|ඇයි අක්ක දන්නවද ඒ මනුස්සයව? ඈ පිළිතුරු දුන්නේ නොරිස්සුමෙනි.
sample_159368|ඒ කියන්නෙ අර නංගි ගිය කඩේ එදා හවස වහල.
sample_159369|අපි කියමු මුදලාලිගෙ කකුල ඇමැට්ටි උනයි කියල ලිස්සල වැටිල ඔයේ නාන කොට.
sample_159370|කොහොම හරි මිනිහ වෙදා හොයාගෙන ගියා කඩේ ගෝලයත් එක්ක බයිසිකලේ.
sample_159371|නංගිට මඟදිම ආරංචි වෙනව කඩේ වහලයි කියල, ඒ පාර නංගි ආපහු එනව.
sample_159372|ඒ නිසා ඈ සෙරෙප්පු දෙකත් දාගෙන පිටත් වෙනව මිතුරියගෙ ගෙදර යන්ට.
sample_159373|ඔහු කිව්වෙ ඇගේ මුහුණ දිහා එක එල්ලේ බලමින්.
sample_159374|මේ වගෙ අනෝරා වැහි වහින දවසට මට තියනවනෙ විශේෂ රාජකාරියක්.
sample_159375|ඇය විමසූයේ ඔහුගේ අතින් අල්ලා ගනිමින් දෙබැමද හකුළුවමිනි.
sample_159376|මෙහෙම වහින දවස්වල මම පාර අයිනෙ තියෙන පරණ කඩ කාමර වගෙ ඒවගේ ටිකක් හෝදිසි කරනව.
sample_159377|හෙහ්, හෙහ්, කාලගුණික තත්වෙ කිව්වෙ මේ දවස්වල මෙහෙට ශීත සෘතුව පටන් ගන්න කාලෙ.
sample_159378|මේ පාර නම් පොඩි වැස්සක් දෙකක් නෙවෙයි සලකල වැස්ස.
sample_159379|පාරවල් හිට යටවෙලා වාහන මහපාර මැද නතර වෙලා මහ එක ගිනි විජ්ජුම්බරයයි.
sample_159380|දේශපාලනික හේතුව අර පොළවෙන් මතුවෙච්චි ගොබ්බය පහුගිය සතියෙ නටපු නාඩගම.
sample_159381|මිනිහෙකුට කිසිම විළි ලැජ්ජාවක් නැතුව මෙහෙමත් අසමජ්ජාති වැඩක් කරන්ට පුලුවන්ද කියල හිතෙන කොටත් පුදුම හිතෙනව.
sample_159382|ඒත් එහෙමෙයි කියල සතියකට සැරයක් වත් මොකවත් ලියල දාන සිරිත
sample_159383|පොඩි කුමාරිහාමිගෙ වලව්වෙ හිටිය ඒ ඇත්තිගෙ කටයුතු කාරණා බලා හදාගන්ට කාර්ය මණ්ඩලයක්ම.
sample_159384|ඇයි අප්පේ කොච්චරක් කාලෙකට ඉහතද? හරි අපි දැන් අහමු කවිකාර කියන කතාව.
sample_159385|මේ කතාන්දරේ මගෙ නමින් දැම්මට මේක මම ලියාපු එකක් එහෙම නෙවෙයි ඔන්න.
sample_159386|ඒ ඇත්තා යන්න කලියෙන් කිව්ව, මම මේ විස්තරේ කතාන්තරයක් වගෙ ලියල
sample_159387|උඹ බය වෙන්න එපා, මම උඹට පුරස්නයක් නොවෙන්න කතාවෙ මුලිම්ම දාන්න ඉන්ගිරිසි වාක්කියකුත් කියන්නම්.
sample_159388|ඔන්න එහෙනම් මනමාල මහතැන්ගෙ කතාව, ශීත සෘතුව අන්තිම කාලෙ උනාට තවම සෑහෙන්න සීතලයි.
sample_159389|තේම්ස් නදිය සිපගෙන එන සුලඟ කොහොමත් ග්‍රීෂ්මෙදි උනත්
sample_159390|හවස සරෝ හම්බවෙලා හයිඩ් පාක් එකේ කතා කර කර ඉඳල අපාර්ට්මන්ට් එකට එනකොට රෑ දහයත් පහුවෙලා.
sample_159391|අද මට හවස යද්දි මොබයිල් එක ගෙනියන්ඩත් අමතක උනානෙ.
sample_159392|මොකද අප්පච්චි මේ මහ රෑ? දැන් ලංකාවෙ වෙලාව කීයද? මම හිතෙන් වෙලාව ගනං හැදුවා.
sample_159393|මම හවස ඉඳලම පුතාට කතාකරන්න බැලුවනෙ
sample_159394|පුතා, ලබන සුමානෙ සෙනසුරාද අපි පොඩි ගමනක් යොදාගෙන තියෙනව.
sample_159395|නිවාඩු නැහැ එහෙම කියන්න නම් එපා ඔන්න
sample_159396|මොකටද අප්පච්චි මේ හදිස්සියෙ? අපි පුතාට හොඳ ගෑණු ළමයෙක් බැලුවා.
sample_159397|කොහෙන්? අලව්වෙන්? ඒ මොකෝ එච්චර දුර බැහැර? මම හිනාවෙවී ඇහුවා.
sample_159398|අර කවුදෝ හින්දි නිළියක් ඉන්නෙ හරියට ආං ඒ වගේමයි කිව්ව.
sample_159399|කවුද, ප්‍රතිභා පටිල් ද? මම හිනාවෙවී ඇහුවා ඒ ඉන්දියාවෙ ජනාධිපතිනිය.
sample_159400|අලියෙකුත් දෙනවලු දෑවැද්දට, මොකෙක්ය කිව්වා? අලියෙක්? මට මොකටද අලියෙක්?
sample_159401|අලියෙක් ඉන්න එක මොන තරම් නම්බුවක්ද කියල පුතාට තේරෙන්නෙ නැති හැටි
sample_159402|මම එන්නංකො අපෙ අප්පච්චිලාටත් වලව්වක් කිව්වොත් ඉතිං වෙන මොකවත් ඕන නැහැ.
sample_159403|දැන් ඉතින් නොගිහින් කොහොමද? යන්ඩම එපාය, ගිහිල්ල කොහොමහරි අප්පච්චිලගෙ හිත නොතැලෙන්ඩ බැහැය කියනව.
sample_159404|අනික මේ චාන්ස් එකත් හොඳයි එක අතකට සරෝ ගැන අම්මටයි අප්පච්චිටයි කියන්න.
sample_159405|එයා මට මුණගැහුනෙ අපේ ඔෆිස් එකට වැඩකට ආපු වෙලාවෙ.
sample_159406|සිංහල හරියට බැහැ මම බැරෑරුම් මූනක් මවාගෙන කිව්ව.
sample_159407|ඒ කරල අපෙ අම්මයි අප්පච්චියි එක්කලා ගියා ඔය කියන කුමාරිහාමි බලන්ඩ.
sample_159408|මේ ගැන නම් මට සහතික වෙන්න බැහැ, මම හරියටම දැක්කෙ නැති නිසා.
sample_159409|ඒත් අපෙ වාහනේ ඉස්සරහින් ඔන්න එක පාරට අලි මුවෙක්ද ගෝනෙක්ද පැන්න පාර
sample_159410|හැබැයි ඒ පස්සෙන් තුවක්කුවක් මානගෙන සරං කොටයක් ගහ ගත්තු වැද්දෙක්
sample_159411|අප්පච්චි බොහොම ආඩම්බරෙන් ඉස්සරහ සීට් එකේ ඉඳගෙන වට පිට නරඹමින් යන ගමන් කිව්වා.
sample_159412|ඒ කාලෙ හැදුවට පස්සෙම අඩුම තරමෙ පස් කූඩයක් වත් දාපු බවක් නම් පෙනෙන්නෙ නැහැ
sample_159413|මොකක්ද අප්පච්චි මේ කරල තියෙන්නෙ? පස්සට වෙලා තොරණෙ හැඩරුව නරඹන අප්පච්චිගෙන් මම ඇහුවෙ තරහින්.
sample_159414|මට මතක් උනේ අර ඩ්‍රැකියුලා ෆිල්ම් වල හොල්මන් මන්දිරේ දොර ඇරෙන්නෙ
sample_159415|ගේට්ටුවට තෙල් ටිකක් දාල නැතුව ඇති මතක ඇති කාලෙකින්.
sample_159416|හපොයි, මේ කවුද අප්පේ මේ? අර ගාන්ධි ඇඳපු අමුඩෙ වගේ මොකක්ද එකකුත්
sample_159417|මොකක්ද මේ මනුස්සය කරන්න යන්නෙ හැබෑටම? මොකක්? වික්ටෝරියා රැජින මැරිලත් දැන් අවුරුදු සීයකට වඩා ගිහින්.
sample_159418|ඔන්න දැක්කද, නියම අපේ කුල සිරිත් වල විදිහට කවි කාරයෙකුත් ඉන්නම ඕනෙ
sample_159419|දැක්කද පුතා මේ අය අපේ ඒ පෞරාණික ලක්ෂණ ඒ විදිහටම ආරක්ෂා කරගෙන යන අපූරුව?
sample_159420|පව්, මම සරෝ ගැන කිව්වම මොකක් වෙයිද මට නම් තේරෙන්නේ නැහැ.
sample_159421|ඔය අර මම කියපු අලියා, සද්දන්ත කුලේ අලි ඔහොම තමයි.
sample_159422|ඒකට ටික දවසකින් පුරුදු වෙයි අප්පච්චිත් නහය එක අතකින් මිරිකගෙන කිව්වා.
sample_159423|ආය කාටද ඉතිං අලි ගඳට පුරුදු වෙන්ට ඕන? අනේ මටනම් එහෙම කිසිම ඕන කමක් නෑ.
sample_159424|වයිවාරණ ගෑණු ද, පිරිමිද, කෙල්ලොද, කොල්ලොද, සැරින් සැරේ ඇවිත් එබිකම් කර කර යනවා.
sample_159425|ඒ අතර සරෝගෙ හැඩ රුවම තියෙන ගෑණු ළමයෙකුත් එහෙ මෙහෙ යනව මම දෙතුන් පාරක්ම දැක්කා.
sample_159426|මේ හුරතලේට හැදිච්ච ළමයනෙ කියල මම අහක බලාගෙන හිටියට හෙට අනිද්දම මම මෙයාගෙ මේ විගඩම්
sample_159427|ඔය ළමය බය වෙන්න ඕන නැහැ ඔන්න ඉතින් තේ කාරිය බීල ඉවර වෙලා ආ.
